<?xml version="1.0" encoding="utf-8"?>
<!DOCTYPE themes [
  <!ELEMENT themes (theme*)>
  <!ELEMENT theme (title,content,createTime)>
  <!ATTLIST theme
   id CDATA #REQUIRED  
   u_id CDATA #REQUIRED>  
  <!ELEMENT title      (#PCDATA)>
  <!ELEMENT content   (#PCDATA)>
  <!ELEMENT createTime   (#PCDATA)>
  
]>
<themes> 
  <theme id="e1df0eff-efb7-4248-b271-3d4ea5ead79b" u_id="949ecdfa-9177-4797-ab77-d8f7ffdfe981"> 
    <title>我是第一个</title>  
    <content>今天天气很好！</content>  
    <createTime>2017/06/03 16:00:58</createTime> 
  </theme>  
  <theme id="54f21972-720b-41f6-a8d3-a538c4f0e5e1" u_id="afd3285d-27b6-425c-a79d-2f5fc60ece38">
    <title>我是AngelOver</title>
    <content>大家好！！！</content>
    <createTime>2017/06/03 16:02:00</createTime>
  </theme>
</themes>
